{
  "$schema": "../schemas/sync-lock.schema.json",
  "format_version": "arp.repo/0.2",
  "authority": "informational_only",
  "protected_sync_receipt_id": "a4704304-2cfe-5eb8-b994-aeba3e8afa09",
  "tenant_id": "799ea40b-e94e-5280-b8f8-b2cc69866950",
  "workspace_id": "bb09fca7-c26f-56d3-9b74-37a0a7c0912b",
  "repository_id": "84488469-4d99-5bbe-89f9-31904bfeaaa7",
  "checkout_binding_id": "f8fa0766-2c89-5126-a15d-60b2e952e441",
  "target_id": "bc37533b-2426-52ec-b0ed-a69e32bba40b",
  "principal_id": "28a83719-2a67-5b49-959e-94aaedb37e4f",
  "agent_release_id": "ece53d40-54a6-5b8d-9f6b-f0b021fb650e",
  "mode_id": "def2e48d-8426-5bf9-b793-a1644a45c5b4",
  "authority_epoch": 7,
  "applied_at": "2026-09-20T17:00:00Z",
  "expires_at": "2026-09-20T18:00:00Z",
  "config_files": [
    {
      "path": ".oxagen/workspace.json",
      "source_commit_id": "aaaaaaaaaaaaaaaaaaaaaaaaaaaaaaaaaaaaaaaa",
      "source_snapshot_id": "b07ed998-b115-5496-bc84-673e20b708e5",
      "cleaned_sha256": "021e276a367a961adb425635fb45517977552de7a74b462feb690b8ccf9f9153"
    },
    {
      "path": ".oxagen/context.json",
      "source_commit_id": "aaaaaaaaaaaaaaaaaaaaaaaaaaaaaaaaaaaaaaaa",
      "source_snapshot_id": "b07ed998-b115-5496-bc84-673e20b708e5",
      "cleaned_sha256": "03a3a67a482d6a2f40ada29bdaf08483de5c9032e86c1066822415b9dccc7fcc"
    },
    {
      "path": ".oxagen/steering.json",
      "source_commit_id": "aaaaaaaaaaaaaaaaaaaaaaaaaaaaaaaaaaaaaaaa",
      "source_snapshot_id": "b07ed998-b115-5496-bc84-673e20b708e5",
      "cleaned_sha256": "e5ff5c25953ebce5bf77c6b4bb31ab27428ed658e958eabf90e741ad62ecbef8"
    }
  ],
  "context_manifest_id": "9f949ad2-c4b4-52bb-aea4-26413ddf9742",
  "steering_manifest_id": "bbcf54ef-29da-561d-a1be-fd8f2b52bab6",
  "policy_revision_ids": [
    "3044cde7-9937-5d0a-98cf-1fe0ba7fe173"
  ],
  "source_versions": [
    {
      "entry_key": "project_start",
      "source": {
        "kind": "vcs_file",
        "path": "docs/start.md",
        "version": "checkout"
      },
      "resolved_source_version": "git-commit:aaaaaaaaaaaaaaaaaaaaaaaaaaaaaaaaaaaaaaaa",
      "cleaned_artifact_id": "3bb3f1ac-1497-5233-b30b-f7c85c6333bc",
      "cleaned_sha256": "ef43c14d397245079eed7097ff134a4cfef094e6c248605cd055bc3c1153be07",
      "status": "loaded"
    },
    {
      "entry_key": "support_rules",
      "source": {
        "kind": "oxagen_record",
        "record_id": "757f4a25-f879-5251-a181-5132f566a54e",
        "revision_id": "c063f6ac-147d-54fb-92bf-c78eb03fa5bd"
      },
      "resolved_source_version": "c063f6ac-147d-54fb-92bf-c78eb03fa5bd",
      "cleaned_artifact_id": "b3322a10-d53e-50ed-91d9-133cc7eb4710",
      "cleaned_sha256": "5555555555555555555555555555555555555555555555555555555555555555",
      "status": "loaded"
    },
    {
      "entry_key": "repo_guidance",
      "source": {
        "kind": "vcs_file",
        "path": "docs/agent-guidance.md",
        "version": "checkout"
      },
      "resolved_source_version": "git-commit:aaaaaaaaaaaaaaaaaaaaaaaaaaaaaaaaaaaaaaaa",
      "cleaned_artifact_id": "9fbcb6f4-00cb-51a1-b9bb-558cbd25d7b7",
      "cleaned_sha256": "ef9a62255b2c6c34be811cb4387560d8c4bc3197226c9f0e27df797c3ca50721",
      "status": "loaded"
    }
  ],
  "prepared_tool_belt_id": "4cb186f8-599a-50d8-9872-c2b10e98b72f"
}
